Episode,Text
Nosedive,"

""Nosedive"" is the first episode in the third series of the British science fiction anthology series Black Mirror. Michael Schur and Rashida Jones wrote the teleplay for the episode, based on a story by series creator and co-showrunner Charlie Brooker, while Joe Wright acted as director. It premiered on Netflix on 21 October 2016, alongside the rest of the third series. The episode is set in a world where people can rate each other from one to five stars for every interaction they have, which can impact their socioeconomic status. Lacie (Bryce Dallas Howard) is a young woman overly obsessed with her ratings; she finds an opportunity to elevate her ratings greatly and move into a more luxurious residence after being chosen by her popular childhood friend (Alice Eve) as the maid of honour for her wedding.

Under Netflix, the episode was given a much larger budget than the previous episodes of the programme, when it had been under Channel 4. Brooker wrote an outline for the episode, then Schur wrote the first half of the episode and Jones wrote the latter. Production was undertaken in a manner similar to a short film; ""Nosedive"" was filmed in South Africa, with Seamus McGarvey as director of photography and Joel Collins and James Foster as the production designers. The tone of the episode is less bleak and more comedic than other Black Mirror episodes, with the ending significantly more positive than in episodes of the programme's prior two series.

The episode received mainly positive reviews and is middling in critics' lists of Black Mirror episodes, qualitatively. The pastel visual aesthetics were widely praised, along with Max Richter's soundtrack and Howard's performance. A criticism from several reviewers was the episode's predictability and ending, though the script and comedic undertones were praised by some. Many critics noted the similarity of the episode to real-world app Peeple and China's Social Credit System, along with fictional works about social media with themes of gender and obsession with image. The episode won a Royal Television Society Craft & Design Award. It was nominated for several awards, including a Screen Actors Guild Award nomination for Howard and a Primetime Emmy Award nomination for McGarvey. A board game Nosedive, based on the episode, was released in 2018.

Society has embraced a technology wherein everyone shares their daily activities through eye implants and mobile devices where one rates their interactions with others on a scale from one to five stars, cumulatively affecting everyone's socioeconomic status.

Lacie Pound (Bryce Dallas Howard) seeks to raise her 4.2 rating to 4.5 for a discount on a luxury apartment; however, despite her attempts to be outgoing and pleasant, her rating has plateaued. Lacie talks to a consultant who suggests gaining favour from very highly rated people. Lacie uploads a photograph of Mr. Rags, a ragdoll that she and her childhood friend Naomi (Alice Eve) made together. Naomi, who is currently rated 4.8, rates the photo five stars and calls Lacie to announce her engagement, inviting Lacie to deliver a wedding speech as the maid of honour. Lacie agrees and commits on the apartment, anticipating many high ratings from the guests.

On the day of her flight, several mishaps cause people to rate Lacie negatively, dropping her rating below 4.2. At the airport, her flight is cancelled and she cannot buy a seat on an alternate flight with her current rating. When Lacie causes a scene, security penalises her by putting her on ""double damage"" and subtracting a full point for 24 hours. Because of her low rating, Lacie can only rent an older car to drive to the wedding, which she cannot recharge when it runs out of power. She is forced to hitchhike with Susan (Cherry Jones), a truck driver with a rating of 1.4. Susan tells Lacie that she used to care about her rating until her late husband was passed over for vital cancer treatment because their scores were deemed not high enough. Susan says she is much freer without obsessing over ratings.

While Lacie is en route to the wedding, Naomi tells her to not come, as her severely reduced rating will negatively impact Naomi's own ratings. Enraged, Lacie reaches the wedding and sneaks in during the reception. She grabs the microphone and starts giving the speech she had written but insults Naomi with references to childhood conflict, finally grabbing a knife and threatening to behead Mr. Rags. The guests rate Lacie negatively, causing her rating to drop below one star. Lacie is imprisoned with her eye implants removed. She and the man in the cell opposite hers (Sope Dirisu) realise they can now speak without worrying about being rated, and gleefully hurl insults at each other.

""Nosedive"" is the first episode of the third series of Black Mirror; all six episodes in this series were released on Netflix simultaneously on 21 October 2016. Brooker says it was selected to be the season premiere ""partly to slightly ease people in"",[1] at Netflix's recommendation.[2] Alongside ""San Junipero"", ""Nosedive"" was first shown in 2016 ahead of its Netflix release at the Toronto International Film Festival.[3] Two days prior to the series' release on Netflix, Brooker hinted that ""Nosedive"" is ""a pastel, playful satire about modern insecurity.""[4]

Whilst series one and two of Black Mirror were shown on Channel 4 in the UK, in September 2015 Netflix commissioned the series for 12 episodes (split into two series of six episodes),[5] and in March 2016 it outbid Channel 4 for the rights to distributing the third series, with a bid of $40 million.[6] Due to its move to Netflix, the show had a larger budget than in previous series,[7] which one critic suggests is responsible for the ""impressive line-up"" that was noted by many reviewers.[8] Another critic called this episode the show's ""most ambitious yet"";[9] due to its larger episode order, series 3 was also able to vary its genre and tone more than previous series.[10] One reviewer also noted that ""Nosedive"" contained ""only American characters"".[3]

In November 2016, to tie in with the episode, Netflix released a tongue-in-cheek app called Rate Me. The app allows users to rate people, by their Twitter handle, and view their own rating and the ratings of others.[11]

The episode is based on an idea by series creator Charlie Brooker for a movie; he and executive producer Annabel Jones pitched the idea to several movie companies in the United States after the first series of Black Mirror, but it was not commissioned.[2] The original idea was of a comedy similar to Brewster's Millions, focused on a high status person trying to reduce their ranking in 24 hours.[2][12] Later, Brooker wrote either a three[13] or four[14] page outline for the episode, wanting it to be ""comedic, darkly"".[13] This version took inspiration from 1987 film Planes, Trains and Automobiles, in which the character is on a journey—for ""Nosedive"", this was initially a character travelling to an important work presentation.[2]

Rashida Jones and Michael Schur wrote the episode. Known for comedy and sitcoms, the pair had previously worked together on many shows, including Parks and Recreation, but had never written anything together before ""Nosedive"".[14] A fan of Brooker's works, Rashida Jones had been in contact with him for a few years beforehand and after the programme's move to Netflix, he suggested that she could write an episode. Schur was also a fan of Black Mirror and Rashida Jones suggested that they could co-write the episode. With Jones and Schur on board, the main character changed from someone focused on playing the ratings system to a people-pleaser, the work presentation was changed to a wedding and the idea of Lacie having a childhood talisman was introduced. Lacie's brother was originally an ex-boyfriend.[2]

Schur wrote the first half of the episode (up to Lacie beginning her travel in a rented car), while Rashida Jones wrote the second half, and the two then combined their scripts.[14] In the initial draft, the episode ended with Lacie's work presentation going viral and her achieving fame. The final version of the ending showed Lacie in a jail cell, the rating device removed from her, allowing her to find freedom. An unused idea was that of rage rooms, where characters would go to destroy things to let out their anger.[2]

In 2016, Schur had an account on Twitter but not Facebook or Instagram, as ""there's a bunch of strangers talking shit about you in there"", and Jones expressed a similarly negative attitude, stating ""I do have very strong, very conflicted feelings about rating systems and social media.""[14] Brooker notes that ""you are rewarded for having a more extreme opinion"" on social media; in the episode, as on the internet, almost all ratings given are either one or five stars.[15] Similarly, Schur opines that social media causes people to exaggerate their behaviour, particularly their rudeness.[16]

Jones believes that the episode, as with all Black Mirror episodes, ""pushes you into the near future"", while Schur considers it to be more of a ""parallel reality"". Brooker has described the episode as ""like a cross between Pleasantville and The Truman Show"".[13] Jones says the belief that ""women are taught to be liked, and men are taught to be powerful"", credited to Sheryl Sandberg, is relevant to the episode, with Schur agreeing that Lacie's gender is important to the story,[15] though Schur notes that edited images on social media are causing negative body image issues for men as well.[16]

The episode was the third in series three to be filmed.[2] Joe Wright directed the episode, Seamus McGarvey was director of photography and the production designers, working for VFX company Painting Practice, were Joel Collins[17] and James Foster.[18] The episode was shot in four weeks[19] in Knysna, South Africa,[2] a coastal town five hours (by car) from Cape Town chosen as it felt like an American coastal town.[17][2] Series three episode ""San Junipero"" was also filmed in South Africa.[17]

In an interview with Variety, McGarvey noted that the episode was shot in 4K resolution at the request of Netflix. He said the colour scheme was a mixture of duck-egg blue, ""peppermint green"" and ""strange peach colors"", and that props and ""even the drinks people are drinking"" were chosen with care to create a ""sickly pastel feel"".[19] Wright said that he made almost no changes to the script's dialogue.[20] Brooker has said that Wright's pastel treatment was a ""very strong visual idea that we had not foreseen"".[21]

Brooker pointed out that directors of Black Mirror episodes (in this case, Wright) have more ""power"" than in serialised television shows, as ""it is like making a short film"", and he said that Wright had ""been feeling quite bruised after doing Pan, and [Black Mirror] was a good thing for him to get his teeth into which wasn't the full five-year commitment of a movie"".[1] McGarvey had previously worked with Wright.[19] Watching rushes from the filming, Brooker was initially sceptical about Wright's saccharine style, but began to understand it as the filming progressed and the music was added.[21] The scenes in which Lacie is driving utilise a computer-generated landscape designed by Dan May, the episode's art director.[17] She was initially planned to drive through multiple landscapes such as a desert, but this was changed for budget reasons.[2]

Bryce Dallas Howard plays Lacie, the episode's main character. She was suggested by Wright, who auditioned her a decade previously for Atonement.[20] Howard gained 30 pounds (14 kg) for the role, saying in an interview with Marie Claire that body shaming is a ""huge part of the subtext of the story"".[22] She chose a laugh for Lacie which mixed ""fear"", ""disingenuousness"" and ""depression"".[2] Howard first joined social media during Thanksgiving 2015 and was approached with the treatment of the episode a fortnight later, in December 2015.[22][23]

Chosen by Wright to compose the episode's soundtrack,[21] Max Richter is a self-described ""conservatoire, university-trained classical composer"".[24] Richter first met the director, Joe Wright, in London before the shooting of the episode had been completed and began coming up with ideas for the score. Richter aimed to ""support"" the episode's display of ""incredible anxiety hovering beneath this smiley surface ... while at the same time not flattening out the emotionality of it"", commenting in an interview that Wright's camerawork had a ""dream-like quality"" and that Brooker's ""story was fantastic"".[25]

In another interview, Richter said he was aiming for the episode to have ""warmth and a fairytale quality throughout"" with ""darkness underneath it"", and notes that his composition was based on ""the sentiment and the emotional trajectory of the characters"". Richter also composed the sound effects which play when one character rates another, and incorporated these sounds into the score itself.[24]

Several critics compared the episode to a 2014 episode of Community, ""App Development and Condiments"", which features an app where users assign each other ""Meow Meow Beenz"" ratings on a scale from one to five; Jack Shepherd of The Independent notes that both episodes ""critically [analyse] people's obsession with stature on social media platforms with rating systems"".[9] Other reviewers compared ""Nosedive"" to the mobile application Peeple,[26] in which users could rate one another, that garnered immediate backlash upon its release.[26][12] Brooker said in an interview that he was not aware of the Community episode when he came up with the idea for ""Nosedive"", but that he did see advertising for Peeple during pre-production, initially thinking it would turn out to be marketing for a comedy show, and he considered whether or not they should still produce the episode.[12] The episode has also been compared to the 2003 novel Down and Out in the Magic Kingdom, as each work explores a link between social approval and power.[27]

Manuel Betancourt of Pacific Standard explains how ""Nosedive"" fits with other portrayals of social media in television and film, comparing it to 2017 films The Circle and Ingrid Goes West, which both explore negative aspects of social media. Betancourt says that historically, women have been portrayed as victims of technology, a pattern which these works fit. For instance, Ingrid and Lacie are both obsessed with coming across as perfect online. In contrast, male characters are traditionally the voice of reason: in these works, Lacie's brother Ryan, Mercer (The Circle) and Taylor's husband (Ingrid Goes West) serve this purpose.[28] The androgyny of ""Nosedive"" character Susan is linked to her disdain for social media.[29] Betancourt writes that these characterisations do not accord with research on how men and women use technology, where some studies report that men have more emotional investment in positive feedback on social media. However, ""Nosedive"" shows people of all genders placing importance in social media, leading Betancourt to call it ""perhaps the most keen-eyed critique [...] of recent titles"".[28]

A Business Insider article by Erin Brodwin notes that the episode shows Lacie fall victim to the hedonic treadmill. Despite momentary happiness when receiving a high rating, Lacie is ""lonely and unsatisfied"". Brodwin points out that scientific studies concur with Lacie's experience, because there is no correlation between using social media and being happy in the long-term.[30]

Critics have also noted the inclusion of Easter eggs within Black Mirror – small details referring to other episodes. In ""Nosedive"", there is a frame where a social media post from Michael Callow reads, ""Just got thrown out of the zoo again :("", a joke based on Callow having intercourse with a pig in ""The National Anthem"".[31] Brooker has described this Easter egg as his favourite in series three.[32] Another reference to that episode is the fictional show Sea of Tranquility; in ""The National Anthem"", a special effects expert mentions having worked on the show, while in ""Nosedive"", Lacie hitchhikes with fans of the show. Additionally, in ""Hated in the Nation"", a news ticker contains the term ""Reputelligent"", which is the name of the company that Lacie consults for advice about her rating.[33]

""Nosedive"" has been widely compared to China's Social Credit System, a government initiative which began pilot projects in 2014,[34] initially using private systems such as Sesame Credit.[35][36] The state projects were implemented differently by local governments, but each collected data on citizens in order to assign them an overall score.[34] An example plan saw the scores determine whether a citizen would be allowed to take out a loan or what quality of school their child would go to. Actions such as defaulting on a loan or being critical of the government would decrease a person's score. By the time ""Nosedive"" was released, the Sesame Credit system, which assigned users scores between 350 and 950,[37] allowed some people with high scores to rent vehicles without a deposit, or pay to skip hospital queues.[35][38] Furthermore, a person's score in Sesame Credit was dependent on the scores of the people in their social circle.[37]

The proposed and existing systems have been widely compared to the episode as a whole. Specifically, it has been noted that the apartment discount Lacie hopes for is similar to how high-rated people under Sesame Credit could rent cars without a deposit.[39] Additionally, Lacie's ejection from the airport is reminiscent of the system's control over who can partake in some forms of transport.[40]

Series creator Charlie Brooker has commented on numerous occasions about links between the episode and the Social Credit System. He joked in an interview, ""I promise you we didn't sell the idea to the Chinese government!"" About seeing the concept of the episode come to life in the real world, Brooker said, ""It was quite trippy"".[41] He comments that a key difference between China's plans and the one in ""Nosedive"" is ""that there's a central government assessing things. Being state-controlled, it feels even more sinister"", and also points out that the Social Credit System ""sounds like an attempt to make the population behave in a particular way"".[42] In November 2016, the Facebook page for Black Mirror shared an article in The Washington Post about the Social Credit System.[note 1]

Adam Mosseri, the CEO of social network Instagram, said he was inspired by ""Nosedive"" to test the hiding of ""likes"" on the Instagram service starting in 2019, recognising the negative connotations that keeping the number of ""likes"" easily visible had on some users' behaviour.[43]

The episode was parodied in the 2017 Saturday Night Live sketch ""Five Stars"". It features Aziz Ansari and Bobby Moynihan desperately trying to impress each other on an Uber ride to boost each other's ratings. The sketch explicitly mentions Black Mirror, with both characters saying that ""San Junipero"" is their favourite episode.[44][45]

Behind her pink and perky façade, Lacie becomes obsessed with social media status in ""Nosedive"", an episode that demonstrates the dangers of society's need for approval but does so with a perfect dose of humor.

–Critics' consensus on Rotten Tomatoes[46]

""Nosedive"" was well received by critics. Review aggregator website Rotten Tomatoes collected 22 reviews, identified 95% of them as positive, and calculated an average rating of 7.33/10.[46] The episode garnered four-star ratings in The Independent and The Guardian,[47][7] along with an A− rating in The A.V. Club.[48] In The Mancunion, the episode received 3.5 stars;[49] it was rated three stars by The Telegraph and the Irish Independent.[8][50] Emefa Setranah of The Mancunion writes that the episode lives up to the show's reputation,[49] and The Guardian's Benjamin Lee says the episode feels fresh despite covering technology similarly to prior episodes.[7]

Charles Bramesco writes in Vulture that it expresses the show's ""guiding theme"" with ""lucid clarity"".[51] TheWrap authors praise how the episode tackles society's social media obsession,[52] and Mat Elfring of GameSpot opines that its thought-provoking nature makes it a good choice for the season premiere.[53] Matt Fowler writes for IGN that the episode is ""both fun and frustrating"" which contrasts with the ""grounded and grim"" episodes to follow.[54] Esquire's Corey Atad opines that it is ""a tad too simplistic"" though ""totally engaging"".[55] Pat Stacey criticises the episode in the Irish Independent that it ""sets up the premise crisply, then spends far too much time labouring the point.""[50]

A major criticism among reviewers was the episode's predictability and repetitiveness,[49][56] while reception to the ending was mixed. Aubrey Page on Collider calls the episode ""woefully surface-level and a bit off-brand"" because of its predictability,[57] with Variety's Andrew Wallenstein agreeing and further saying that the episode lacks a disturbing tone, though this makes it more accessible.[58] Zack Handlen of The A.V. Club believes that the first half of ""Nosedive"" is too predictable but the second half ""[adds] depth and sincerity"".[48] Tasha Robinson writes for The Verge that the episode ""can be strident and obvious"" but ""understands human nature very well"".[27] Some reviewers believed the episode was too long and the ending was too positive.[26][48] However, Digital Spy's Alex Mullane praised the ending, because though it is ""bleak in some ways"" it is also ""a moment of sheer, fist-pumping joy"";[59] Jacob Hall agrees on /Film, calling the ending ""simultaneously cathartic and on-the-nose"".[60]

Critics had a mostly positive response to the script as a whole, with some noting comedic undertones.[61] Robinson describes the episode as an ""exaggerated morality play about the dangers of conformity and the small pleasures of individuality"".[27] The script has been called ""bitingly hilarious"",[3] ""funny"", ""uplifting"",[59] ""moving"" and ""supremely unsettling"".[51] Lee approves of the script avoiding exposition.[7] On the other hand, The Telegraph's Mark Monahan criticises that the plot and characters do not live up to their potential.[8] Page feels the episode ""lacks the sadistic snap of Brooker's usual work"".[57]

The episode's visual style and Joe Wright's directing were highly commended;[47] the setting for the episode garnered positive reception.[3][7][8] Hall compliments ""stellar production values"".[60] Sophie Gilbert of The Atlantic praises the juxtaposition of calm visuals with narrative tension.[26] Robinson notes that the aesthetics mark a difference between the characters with high and low ratings.[27] Adam Chitwood comments for Collider that the visual style ""keeps everything focused on the characters"", which is different to Joe Wright's typical style.[3] Setranah notes that Netflix's large budget is apparent in the visuals of the episode,[49] and The Independent writers suggest it is detailed enough to be revisited.[62]

Many critics praised Howard's performance,[48][49] with Atad calling it ""delightfully unhinged"".[55] Additionally, Gilbert writes that Howard ""conveys Lacie's inner frustration while grinning cheerfully through it"".[26] Howard's acting ensures viewers are on Lacie's side, according to Mullane, who also compliments Eve's acting as ""excellent"".[59]

Max Richter's musical composition for the episode was well received. The Independent writers compliment Richter for ""blending the diegetic sounds of the app with the non-diegetic score evoking our protagonist's struggle to determine reality and fiction"",[47] an element which Robinson also praises.[27] Fowler calls the score ""very compelling""[54] and Monahan describes it as ""elegantly elegiac"".[8]

Julien Migozzi found similarities between the episode and the segregation that South Africans suffer under credit score systems.[63]

""Nosedive"" appears on many critics' rankings of the 19 episodes in Black Mirror, from best to worst.



Instead of by quality, Proma Khosla of Mashable ranked each episode by tone, concluding that ""Nosedive"" is the 15th most pessimistic of the 19 episodes.[68]

Other critics ranked the 13 episodes in Black Mirror's first three series.



Some critics ranked the six episodes from series three of Black Mirror in order of quality.

""Nosedive"" was nominated for several awards in 2017; the third season of Black Mirror also received several other nominations and awards.

Based on the episode, the board game Nosedive was produced by Asmodee. Released on 25 November 2018, the game requires between three and six players and is designed to last for roughly 45 minutes.[78] A mobile app, available for Android or iOS, is used to play the game; it initially assigns each player a Social Score. In the initial Lifestyle phase, players draw cards which have ratings between one and five stars, such as the one star card ""A six-minute lunch break"". They tactically assign them to stacks and then each player selects a stack.[79]

In the Experience phase, players assign each other experiences such as ""Receiving an anonymous hate cake"" and each player then rates their received experiences from one to five stars. The app then adjusts each player's Social Score based on these ratings. At the end of the game, players earn points from the Lifestyle cards they own which have star ratings less than or equal to their Social Score.[79]

Tasha Robinson of The Verge criticised the game's mechanics as feeling arbitrary, as users' Social Scores are mostly determined by random factors. However, Robinson praised the app's design, the game's pastel aesthetics and the humour of the Experience cards, which can lead to interesting discussion.[79]
"
